{
  "province": "NB",
  "province_name": "New Brunswick",
  "effective_from": "2025-01-01",
  "effective_to": null,
  "rates": [
    {
      "rate_id": "NB-HST-2025",
      "tax_type": "HST",
      "rate": 0.15,
      "component": "COMBINED",
      "description": "New Brunswick Harmonized Sales Tax",
      "effective_from": "2025-01-01",
      "effective_to": null,
      "source_url": "https://www.canada.ca/en/revenue-agency/services/tax/businesses/topics/gst-hst-businesses/charge-collect-which-rate.html",
      "notes": "Combined federal (5%) and provincial (10%) portions. HST implemented April 1, 1997."
    }
  ],
  "notes": "New Brunswick uses a single HST rate of 15%. One of the original HST provinces."
}
